{
  "schema_version": "1.1",
  "nodes": [
    {
      "id": "n1",
      "type": "terminator",
      "text": "Início",
      "bbox": [
        200.0,
        20.0,
        400.0,
        80.0
      ],
      "confidence": 1.0
    },
    {
      "id": "n2",
      "type": "input_output",
      "text": "Receber solicitação",
      "bbox": [
        180.0,
        120.0,
        420.0,
        180.0
      ],
      "confidence": 1.0
    },
    {
      "id": "n3",
      "type": "process",
      "text": "Validar dados",
      "bbox": [
        180.0,
        220.0,
        420.0,
        280.0
      ],
      "confidence": 1.0
    },
    {
      "id": "n4",
      "type": "decision",
      "text": "Dados completos?",
      "bbox": [
        180.0,
        320.0,
        420.0,
        440.0
      ],
      "confidence": 1.0
    },
    {
      "id": "n5",
      "type": "process",
      "text": "Solicitar correção",
      "bbox": [
        500.0,
        350.0,
        740.0,
        410.0
      ],
      "confidence": 1.0
    },
    {
      "id": "n6",
      "type": "terminator",
      "text": "Fim",
      "bbox": [
        200.0,
        500.0,
        400.0,
        560.0
      ],
      "confidence": 1.0
    }
  ],
  "edges": [
    {
      "id": "e1",
      "source": "n1",
      "target": "n2",
      "confidence": 1.0,
      "label": ""
    },
    {
      "id": "e2",
      "source": "n2",
      "target": "n3",
      "confidence": 1.0,
      "label": ""
    },
    {
      "id": "e3",
      "source": "n3",
      "target": "n4",
      "confidence": 1.0,
      "label": ""
    },
    {
      "id": "e4",
      "source": "n4",
      "target": "n5",
      "confidence": 1.0,
      "label": "Não",
      "branch": "no"
    },
    {
      "id": "e5",
      "source": "n5",
      "target": "n2",
      "confidence": 1.0,
      "label": ""
    },
    {
      "id": "e6",
      "source": "n4",
      "target": "n6",
      "confidence": 1.0,
      "label": "Sim",
      "branch": "yes"
    }
  ],
  "metadata": {
    "title": "Exemplo do padrão visual",
    "visual_standard": "1.0"
  }
}
